{
  "id": "webgpu-apple-m5-pro-macos26-chrome152-sg32-burst1-flush32-lookahead1",
  "family": "qwen3-4b-q4f16-1",
  "runtimeKind": "webllm",
  "variant": "exact-greedy",
  "created": "2026-09-06",
  "producedBy": {
    "workbench": "OlehZhyhinas/webnn-workbench@21e1e562b40fa551b9eeabffc092d54605f28989",
    "date": "2026-09-06",
    "recorder": "bench/webnn/qwen/run-webllm-interleaved.mjs",
    "note": "Warm model and pipelines, explicit KV reset, rotating fresh prompts, persistent real Chrome profile, WEBNN_MAX_LOAD=0 under sustained background CPU load; every ratio paired within a round against the live sibling entry stack."
  },
  "title": "Qwen3-4B q4f16_1: exact greedy WebLLM/WebGPU on Apple M5 Pro, K=1 with GPU lookahead",
  "summary": "Sibling flush32 stack (subgroup-32, chunk-256 GPU argmax, GEMV TR=32, batch pass, submit every 32 dispatches) with a burst of one token and one decode step kept queued on the GPU across each readback. Measured 78.50 tokens/s and 1.063x paired decode against the live sibling stack under sustained background CPU load, byte-identical output, per-token streaming.",
  "target": {
    "generatedAt": "2026-09-06T23:50:00.000Z",
    "tool": "webnn-workbench bench/webnn/qwen/run-webllm-interleaved.mjs",
    "backend": {
      "name": "webgpu",
      "deviceType": "gpu",
      "webgpu": {
        "api": "Dawn over Metal 3",
        "wgslLanguageFeatures": [],
        "requirements": {
          "features": [
            "shader-f16",
            "subgroups",
            "subgroup-size-control"
          ],
          "limits": {
            "minSubgroupSize": 32,
            "maxSubgroupSize": 32
          },
          "subgroups": {
            "required": true,
            "minSize": 32,
            "maxSize": 32,
            "features": [
              "subgroups",
              "subgroup-size-control"
            ]
          }
        }
      },
      "observable": "browser"
    },
    "browser": {
      "name": "Chrome",
      "version": "152.0.7977.77",
      "major": 152,
      "engine": "Chromium 152.0.7977.77",
      "userAgent": "Mozilla/5.0 (Macintosh; Intel Mac OS X 10_15_7) AppleWebKit/537.36 (KHTML, like Gecko) Chrome/152.0.0.0 Safari/537.36",
      "flags": [
        "--enable-unsafe-webgpu",
        "--enable-features=WebGPUExperimentalFeatures",
        "--enable-dawn-features=allow_unsafe_apis"
      ],
      "profile": "persistent",
      "observable": "browser"
    },
    "os": {
      "name": "macOS",
      "version": "26.6.2",
      "major": 26,
      "build": "25G83",
      "browserReported": {
        "platform": "macOS",
        "platformVersion": "26.6.2",
        "architecture": "arm",
        "bitness": "64"
      },
      "observable": "browser(partial)/host"
    },
    "gpu": {
      "vendor": "apple",
      "architecture": "metal-3",
      "device": "",
      "description": "",
      "subgroupMinSize": 32,
      "subgroupMaxSize": 32,
      "features": [
        "bgra8unorm-storage",
        "chromium-experimental-subgroup-matrix",
        "clip-distances",
        "core-features-and-limits",
        "depth-clip-control",
        "depth32float-stencil8",
        "dual-source-blending",
        "float32-blendable",
        "float32-filterable",
        "indirect-first-instance",
        "primitive-index",
        "rg11b10ufloat-renderable",
        "shader-f16",
        "subgroup-size-control",
        "subgroups",
        "texture-component-swizzle",
        "texture-compression-astc",
        "texture-compression-astc-sliced-3d",
        "texture-compression-bc",
        "texture-compression-bc-sliced-3d",
        "texture-compression-etc2",
        "texture-compression-unaligned",
        "texture-formats-tier1",
        "texture-formats-tier2",
        "timestamp-query"
      ],
      "limits": {
        "maxComputeWorkgroupStorageSize": 32768,
        "maxComputeInvocationsPerWorkgroup": 1024,
        "maxComputeWorkgroupSizeX": 1024,
        "maxStorageBufferBindingSize": 4294967292,
        "maxBufferSize": 4294967292,
        "maxBindGroups": 4,
        "maxStorageBuffersPerShaderStage": 10
      },
      "observable": "browser"
    },
    "host": {
      "platform": "darwin",
      "chip": "Apple M5 Pro",
      "gpuCores": 20,
      "memoryGB": 64,
      "cpuThreads": 18,
      "loadAvg": [
        20.18,
        19.03,
        17.08
      ],
      "unavailable": [],
      "observable": "host"
    },
    "perfClass": {
      "f16TflopsMeasured": 5.69,
      "method": "WGSL tiled f16 matmul 2048x2048x2048, 128x128 workgroup tile, 8x8 per invocation, f32 accumulate; lower bound, not peak.",
      "shape": [
        2048,
        2048,
        2048
      ],
      "iterations": 53,
      "elapsedMs": 160,
      "checked": true,
      "error": null,
      "observable": "browser(probe)"
    }
  },
  "compat": {
    "requires": {
      "backend.name": "webgpu",
      "gpu.subgroupMinSize": 32,
      "gpu.subgroupMaxSize": 32
    },
    "notes": "The tuned model library requires shader-f16 plus subgroup size 32. The verified loader checks WebGPU and subgroup support before downloading model weights. The lookahead flag needs runtime/webllm-loader.js at or after the commit that introduced runtime.config.lookahead; an older loader ignores the field and runs the sibling entry behaviour."
  },
  "artifacts": "artifacts.json",
  "model": {
    "id": "Qwen3-4B-q4f16_1-MLC",
    "revision": "a5c9fab855e3ccbdfed2e7e69683d75f30332161",
    "config": {
      "vramRequiredMB": 3431.59,
      "lowResourceRequired": true,
      "overrides": {
        "context_window_size": 4096
      }
    }
  },
  "runtime": {
    "name": "WebLLM",
    "version": "0.2.84-qwen-m5-lookahead",
    "abi": {
      "webllm": "0.2.84",
      "wasmSystemLibPrefix": "Qwen3-4B-q4f16_1-MLC",
      "tvmjs": "MLC WebLLM 0.2.84"
    },
    "config": {
      "greedyBurst": 1,
      "greedyArgmax": true,
      "deferDecodeCleanup": false,
      "argmaxChunk": 256,
      "gemvThreadRows": 32,
      "batchPass": true,
      "flushEvery": 32,
      "bindGroupCache": false,
      "engineConfig": {},
      "lookahead": 1
    }
  },
  "source": {
    "repository": "https://github.com/OlehZhyhinas/web-llm-qwen",
    "commit": "21698fd421d278ad0f7b3cc4e23abe3eaf4a042d"
  },
  "license": {
    "name": "Apache License 2.0",
    "spdx": "Apache-2.0",
    "url": "https://www.apache.org/licenses/LICENSE-2.0"
  },
  "capabilities": {
    "fastPath": {
      "eligible": true,
      "requirements": [
        "temperature == 0",
        "logprobs disabled",
        "no grammar or structured-output matcher",
        "no logit bias or custom logit processor",
        "frequency_penalty == 0",
        "presence_penalty == 0",
        "repetition_penalty == 1"
      ],
      "fallback": {
        "available": true,
        "kind": "webllm-one-step-sampler",
        "notes": "The runtime checks each request and retains the normal one-token sampler whenever any exact-greedy eligibility condition fails."
      }
    }
  },
  "verification": "verification/corpus.json",
  "measurements": "measurements.json",
  "provenance": "provenance.md"
}
