{
  "id": "webgpu-apple-m5-pro-macos26-chrome152-sg32-burst1-flush32-pl5",
  "family": "qwen3.5-0.8b-q4f16-1",
  "runtimeKind": "webllm",
  "variant": "exact-greedy",
  "created": "2026-09-10",
  "producedBy": {
    "workbench": "OlehZhyhinas/webnn-workbench@prompt-lookup",
    "date": "2026-09-10",
    "recorder": "bench/webnn/qwen/run-webllm-interleaved.mjs",
    "note": "Paired A/B within one Chrome session on 120 real arXiv paragraphs, alternating order per item, resetChat between sides, greedy decode, max_tokens 512, WEBNN_MAX_LOAD=0."
  },
  "title": "Qwen3.5-0.8B q4f16_1: exact greedy WebLLM/WebGPU on Apple M5 Pro, prompt-lookup K=5",
  "summary": "Subgroup-32, chunk-256 two-stage GPU argmax, batch pass, flush cadence 32, and prompt-lookup drafting with forked verification state (k=5, nMax=3, nMin=2). This replaces the earlier burst5 rollback path for the recurrent model.",
  "target": {
    "generatedAt": "2026-09-08T11:33:43.872Z",
    "tool": "webnn-workbench bench/webnn/qwen/run-webllm-interleaved.mjs",
    "backend": {
      "name": "webgpu",
      "deviceType": "gpu",
      "webgpu": {
        "api": "Dawn over Metal 3",
        "wgslLanguageFeatures": [],
        "requirements": {
          "features": [
            "shader-f16",
            "subgroups",
            "subgroup-size-control"
          ],
          "limits": {
            "minSubgroupSize": 32,
            "maxSubgroupSize": 32
          },
          "subgroups": {
            "required": true,
            "minSize": 32,
            "maxSize": 32,
            "features": [
              "subgroups",
              "subgroup-size-control"
            ]
          }
        }
      },
      "observable": "browser"
    },
    "browser": {
      "name": "Chrome",
      "version": "152.0.7977.77",
      "major": 152,
      "engine": "Chromium 152.0.7977.77",
      "userAgent": "Mozilla/5.0 (Macintosh; Intel Mac OS X 10_15_7) AppleWebKit/537.36 (KHTML, like Gecko) Chrome/152.0.0.0 Safari/537.36",
      "flags": [
        "--enable-unsafe-webgpu",
        "--enable-features=WebGPUExperimentalFeatures",
        "--enable-dawn-features=allow_unsafe_apis"
      ],
      "profile": "persistent",
      "observable": "browser"
    },
    "os": {
      "name": "macOS",
      "version": "26.6.2",
      "major": 26,
      "build": "25G83",
      "browserReported": {
        "platform": "macOS",
        "platformVersion": "26.6.2",
        "architecture": "arm",
        "bitness": "64"
      },
      "observable": "browser(partial)/host"
    },
    "gpu": {
      "vendor": "apple",
      "architecture": "metal-3",
      "device": "",
      "description": "",
      "subgroupMinSize": 32,
      "subgroupMaxSize": 32,
      "features": [
        "bgra8unorm-storage",
        "chromium-experimental-subgroup-matrix",
        "clip-distances",
        "core-features-and-limits",
        "depth-clip-control",
        "depth32float-stencil8",
        "dual-source-blending",
        "float32-blendable",
        "float32-filterable",
        "indirect-first-instance",
        "primitive-index",
        "rg11b10ufloat-renderable",
        "shader-f16",
        "subgroup-size-control",
        "subgroups",
        "texture-component-swizzle",
        "texture-compression-astc",
        "texture-compression-astc-sliced-3d",
        "texture-compression-bc",
        "texture-compression-bc-sliced-3d",
        "texture-compression-etc2",
        "texture-compression-unaligned",
        "texture-formats-tier1",
        "texture-formats-tier2",
        "timestamp-query"
      ],
      "limits": {
        "maxComputeWorkgroupStorageSize": 32768,
        "maxComputeInvocationsPerWorkgroup": 1024,
        "maxComputeWorkgroupSizeX": 1024,
        "maxStorageBufferBindingSize": 4294967292,
        "maxBufferSize": 4294967292,
        "maxBindGroups": 4,
        "maxStorageBuffersPerShaderStage": 10
      },
      "observable": "browser"
    },
    "host": {
      "platform": "darwin",
      "chip": "Apple M5 Pro",
      "gpuCores": 20,
      "memoryGB": 64,
      "cpuThreads": 18,
      "loadAvg": [
        14.4,
        14.85,
        15.22
      ],
      "unavailable": [],
      "observable": "host"
    },
    "perfClass": {
      "f16TflopsMeasured": 5.76,
      "method": "WGSL tiled f16 matmul 2048x2048x2048, 128x128 workgroup tile, 8x8 per invocation, f32 accumulate; lower bound, not peak.",
      "shape": [
        2048,
        2048,
        2048
      ],
      "iterations": 52,
      "elapsedMs": 155.2,
      "checked": true,
      "error": null,
      "observable": "browser(probe)"
    }
  },
  "compat": {
    "requires": {
      "backend.name": "webgpu",
      "gpu.subgroupMinSize": 32,
      "gpu.subgroupMaxSize": 32
    },
    "notes": "The tuned model library requires shader-f16 plus subgroup size 32. The verified loader checks WebGPU and subgroup support before downloading model weights. promptLookup is parsed before engine creation and sets the fork strategy up front so the runtime allocates two decode sequences. Quality caveat: output is not byte-identical in general; batch-verify prefill kernels and decode GEMV kernels differ in low bits, so near-tie argmaxes can flip on a few percent of items. Family byte-identical verification corpus result for this entry: 10/10 corpus cases byte-identical, verified 2026-09-10 with scripts/verify-webllm.mjs against this branch's raw entry URL (bench/verify-qwen3.5-0.8b-q4f16-1-pl5.json)."
  },
  "artifacts": "artifacts.json",
  "model": {
    "id": "Qwen3.5-0.8B-q4f16_1-MLC",
    "revision": "0ec138972555613c1d7812a821778ad0398c8790",
    "config": {
      "vramRequiredMB": 1629.49,
      "lowResourceRequired": true,
      "overrides": {
        "context_window_size": 4096,
        "max_history_size": 7
      }
    }
  },
  "runtime": {
    "name": "WebLLM",
    "version": "0.2.84-qwen-m5-prompt-lookup",
    "abi": {
      "webllm": "0.2.84",
      "wasmSystemLibPrefix": "Qwen3.5-0.8B-q4f16_1-MLC",
      "tvmjs": "MLC WebLLM 0.2.84"
    },
    "config": {
      "greedyBurst": 1,
      "greedyArgmax": true,
      "deferDecodeCleanup": false,
      "argmaxChunk": 256,
      "gemvThreadRows": 64,
      "batchPass": true,
      "flushEvery": 32,
      "bindGroupCache": false,
      "lookahead": 0,
      "promptLookup": "5:3:2:fork",
      "engineConfig": {}
    }
  },
  "source": {
    "repository": "https://github.com/OlehZhyhinas/web-llm-qwen",
    "commit": "ff2ed7c61f5fd01b5fca8618cc2baa08c2866ad4"
  },
  "license": {
    "name": "Apache License 2.0",
    "spdx": "Apache-2.0",
    "url": "https://www.apache.org/licenses/LICENSE-2.0"
  },
  "capabilities": {
    "fastPath": {
      "eligible": true,
      "requirements": [
        "temperature == 0",
        "logprobs disabled",
        "no grammar or structured-output matcher",
        "no logit bias or custom logit processor",
        "frequency_penalty == 0",
        "presence_penalty == 0",
        "repetition_penalty == 1"
      ],
      "fallback": {
        "available": true,
        "kind": "webllm-one-step-sampler",
        "notes": "The runtime checks each request and retains the normal one-token sampler whenever any exact-greedy eligibility condition fails."
      }
    }
  },
  "verification": "verification/corpus.json",
  "measurements": "measurements.json",
  "provenance": "provenance.md"
}
